question,answer
"Apa layanan utama TSP Digital?","TSP Digital menawarkan Strategy & Blueprint, Full-Stack Development, dan AI & ML Integration."
"Apa yang dimaksud dengan Phase 1 di engagement protocol TSP Digital?","Phase 1 adalah Strategic Deep Dive yang mencakup Stakeholder Workshops, Technical & Business Audit, dan Finalized Strategic Blueprint."
"Apa output akhir dari fase Strategic Deep Dive?","Output akhirnya adalah Finalized Strategic Blueprint."
"Apa kegiatan utama di Phase 2?","Phase 2 yakni Architectural Design & Prototyping meliputi User Flow & Journey Mapping, High-Fidelity Prototypes, dan Technical Architecture Plan."
"Apa fungsi High-Fidelity Prototypes?","High-Fidelity Prototypes memungkinkan klien melihat dan merasakan solusi secara detail sebelum pengembangan dimulai."
"Apa yang dilakukan selama Phase 3?","Phase 3 adalah Agile Development Sprints yang mencakup Backend & API Development, Frontend Component Construction, dan Bi-Weekly Sprint Reviews."
"Berapa lama durasi sprint yang digunakan TSP Digital?","Sprint di TSP Digital berlangsung dua minggu (bi-weekly)."
"Apa yang diuji dalam Phase 4?","Phase 4 adalah Rigorous Quality Assurance yang mencakup Automated & Manual Testing, User Acceptance Testing (UAT), dan Performance & Security Audits."
"Apa tujuan dari Phase 5?","Phase 5 adalah Deployment & Strategic Partnership yang mencakup Server Configuration, App Store Submission, Post-Launch Monitoring, dan penyusunan Long-Term Growth Roadmap."
"Apa itu AI-Powered Aerial Inspection System di portofolio TSP Digital?","Sistem inspeksi aeronautika berbasis computer vision menggunakan YOLOv8 dan OpenCV untuk mendeteksi kerusakan badan pesawat dari video drone."
"Apa teknologi utama yang digunakan dalam sistem inspeksi pesawat tersebut?","Teknologi utamanya adalah YOLOv8 dan OpenCV."
"Apa manfaat sistem inspeksi udara TSP Digital?","Meningkatkan kecepatan dan akurasi inspeksi kerusakan pesawat."
"Apa contoh solusi full-stack dalam portofolio TSP Digital?","Real-Time Project & Attendance Platform yang dibangun menggunakan Node.js dan integrasi database cloud."
"Apa fungsi Real-Time Project & Attendance Platform?","Memfasilitasi penugasan tugas, pelacakan progres, dan kolaborasi tim secara real-time."
"Apa teknik machine learning yang digunakan dalam Predictive Heart Disease Model?","Menggunakan Random Forest."
"Apa platform stack visualisasi yang digunakan dalam model prediksi penyakit jantung?","Menggunakan Streamlit untuk visualisasi interaktif."
"Apa solusi TSP Digital untuk fasilitas kesehatan nasional?","Nationwide Blood Bank Application."
"Apa sistem yang digunakan untuk pemantauan infrastruktur?","AI-Powered Infrastructure Monitoring."
"Apa teknologi yang dipakai untuk sistem identitas terdesentralisasi?","Melalui Decentralized Identity Platform berbasis blockchain."
"Apa sistem darurat yang dikembangkan TSP Digital?","Emergency Autoresponder System."
"Apa solusi aplikasi web komersial yang disediakan?","Full-Stack Booking & Dashboard Systems."
"Apa moto utama TSP Digital?","We Don’t Build Apps. We Build Unfair Advantages."
"Apa tagline TSP Digital di bagian layanan?","Mereka weaponize your data and automate your processes using AI and intelligent software."
"Mengapa TSP Digital tidak langsung menulis kode di fase pertama?","Karena mereka melakukan Strategic Deep Dive untuk benar-benar memahami bisnis, tantangan operasional, dan tujuan strategis klien terlebih dahulu."
"Apa saja tahapan workshop dalam Strategic Deep Dive?","Stakeholder Workshops dan Technical & Business Audit."
"Apa yang menjadi titik awal desain arsitektur sistem?","Setelah Strategic Deep Dive, lalu dilakukan Architectural Design & Prototyping."
"Apa deliverable utama dari desain arsitektur dan prototyping?","User Flow & Journey Mapping, High-Fidelity UI/UX Prototypes, dan Technical Architecture Plan."
"Bagaimana transparansi dipastikan selama Agile Development Sprints?","Melalui Bi-Weekly Sprint Reviews yang memungkinkan klien melihat progres real-time."
"Apa saja jenis pengujian dalam QA?","Automated Testing dan Manual Testing."
"Siapa yang melakukan UAT?","User Acceptance Testing dilakukan bersama user klien."
"Apa fokus audit performa dan keamanan di QA?","Performance & Security Audits memastikan aplikasi stabil, aman, dan siap digunakan."
"Apa langkah pertama setelah deployment?","Server Configuration dan App Store Submission."
"Apa yang dimonitor setelah peluncuran?","Post-Launch Performance Monitoring."
"Apa tujuan dari strategic partnership pasca-launch?","Menyiapkan Long-Term Growth Roadmap dan mendukung iterasi solusi berkelanjutan."
"Apa strategi pendekatan TSP Digital dalam engagement dengan klien?","Melalui pendekatan sistematik: Deep Dive → Prototyping → Agile → QA → Deployment & Partnership."
"Apa keuntungan model development berlapis seperti ini?","Mengurangi risiko, menghindari kejutan, dan memastikan kualitas produk akhir."
"Dalam sistem inspeksi udara, dari mana data diambil?","Melalui footage drone."
"Untuk platform kehadiran real-time, apa yang dikelola sistem?","Task assignment, progress tracking, dan tim collaboration."
"Apa model prediktif pada aplikasi kesehatan?","Predictive Heart Disease Model."
"Apakah solusi blood bank berskala nasional?","Ya, Nationwide Blood Bank Application."
"Untuk identity platform, teknologi apa yang digunakan?","Blockchain terdesentralisasi."
"Apakah emergency autoresponder bekerja secara otomatis?","Ya, sistem merespons darurat menggunakan AI."
"Untuk aplikasi booking, apa yang disediakan?","Booking & Dashboard Systems."
"Apa goal monitoring infrastruktur?","Memastikan performa dan stabilitas dengan AI monitoring."
"Sebutkan bahasa pemrograman untuk backend Real-Time Platform?","Menggunakan Node.js."
"Apa framework visualisasi untuk predictive model?","Streamlit."
"Apakah prototyping dilakukan sebelum coding?","Ya, sebelum menulis kode, TSP Digital membuat prototipe interaktif."
"Apa audit keamanan dilakukan?","Dilakukan dalam fase QA, termasuk performance & security audits."
"Apakah TSP Digital menawarkan growth roadmap?","Ya, sebagai bagian dari fase Deployment & Strategic Partnership."
"Apa audit dilakukan di Phase 4?","User Acceptance Testing dan performance/security audits."
"Bagaimana aplikasi dikembangkan?","Melalui bi-weekly sprints dengan backend dan frontend development."
"Apakah wireframe dibuat di fase awal?","Ya, di fase Architectural Design & Prototyping."
"Apa jenis testing otomatis yang dilakukan?","Automated Testing (bersama manual dan UAT)."
"Apakah deployment dilanjutkan dengan support?","Ya, deployment diikuti oleh strategic partnership dan support jangka panjang."
"Apa keunggulan model AI infrastrukturnya?","Memantau infrastruktur secara cerdas untuk deteksi dini."
